{
  "$schema": "https://json-schema.org/draft/2020-12/schema",
  "$id": "checkpoint.schema.json",
  "type": "object",
  "additionalProperties": false,
  "required": [
    "schema_version", "run_id", "current_phase", "phase_status",
    "phase_artifact_hashes", "completed_files",
    "config_hash", "prompt_hash", "model_fingerprint",
    "tool_pack_hash", "lens_version"
  ],
  "properties": {
    "schema_version": {"const": 1},
    "run_id": {"type": "string", "pattern": "^[0-9A-Z]{26}$"},
    "current_phase": {
      "enum": ["preflight", "discovery", "file_audit", "crosscut", "aggregate"]
    },
    "phase_status": {
      "type": "object",
      "additionalProperties": {
        "enum": ["pending", "in_progress", "complete", "errored"]
      }
    },
    "phase_artifact_hashes": {
      "type": "object",
      "additionalProperties": {"type": "string"}
    },
    "completed_files": {
      "type": "array",
      "items": {
        "type": "object",
        "additionalProperties": false,
        "required": ["path", "completed_at"],
        "properties": {
          "path": {"type": "string"},
          "completed_at": {"type": "string", "format": "date-time"}
        }
      }
    },
    "config_hash":             {"type": "string"},
    "prompt_hash":             {"type": "string"},
    "model_fingerprint":       {"type": "string"},
    "tool_pack_hash":          {
      "type": "string",
      "description": "Computed by senex.tools.registry.compute_tool_pack_hash() at preflight (see M5 Task 5.10). Consumed by Checkpoint.is_compatible() (M1) and embedded in findings.json (M7 Task 7.3) + RunStart event (M1 Task 1.3)."
    },
    "lens_version":            {"type": "string"}
  }
}
