{
  "completed_files": [
    {
      "completed_at": "2026-05-01T19:59:47.764956+00:00",
      "path": "healthy.py"
    },
    {
      "completed_at": "2026-05-01T19:59:47.842665+00:00",
      "path": "io_helper.py"
    },
    {
      "completed_at": "2026-05-01T19:59:47.914126+00:00",
      "path": "main.py"
    },
    {
      "completed_at": "2026-05-01T19:59:47.984153+00:00",
      "path": "util.py"
    }
  ],
  "config_hash": "5186e14578887606b06cd2e3b88f1fe0c97a688d67acc5506a049d28202d516b",
  "current_phase": "crosscut",
  "lens_version": "1.0.0",
  "model_fingerprint": "466fd70dd8f3b8c3339ba3561621a0727923a05bc320c276cbb331edc90ceefb",
  "phase_artifact_hashes": {},
  "phase_status": {
    "aggregate": "pending",
    "crosscut": "in_progress",
    "discovery": "complete",
    "file_audit": "complete",
    "preflight": "complete"
  },
  "prompt_hash": "de364503023f58f286fee89a35bc376f7401afc75f7fc947d1bc298fccb4999a",
  "run_id": "01KQJHZJVYCA3AC0SWV723CRM2",
  "schema_version": 1,
  "tool_pack_hash": "454a3d15377e48c6de58e3ed2ef4972f9edf7062353d29581b927bc04b8f7800"
}